name_of_sight,location,category,description,likes_count,location_url
Ikeja city mall,Lagos,Mall,"About Ikeja city mall  Ikeja city mall was built in 2011 to allow mainlanders have fun without having to journey to the island. It was built by Broll property services in 2011.  Why go all the way to Shop rite at Lekki when City mall offers you that and even more. There is a cinema, there are restaurants and a whole lot of other interesting activities. What are you waiting for? Come join in the fun.  Security/Safety of Ikeja city mall  This is a very safe location.  What To Bring  Before heading to Ikeja city mall, here are some helpful things to take along with you:   Camera  Cash/debit cards   Things to do while at Ikeja city mall  These are things you can do at Ikeja City Mall:   See a movie  Get pizza, ice cream, chocolate  Hangout with friends and family  Take beautiful picture  Window shop or shop for real&nbsp;   Best Features  It is fun  Most common visitors  People looking to relax from the stress of work or school.",697,https://hotels.ng/places/mall/37-ikeja-city-mall
Lekki Leisure lake,Lagos,Beach,"&nbsp;  About Lekki Leisure Lake  Lekki Leisure Lake is a lakeside resort in the Lekki peninsula area with a magnificent view of the Atlantic. The resort is under the administration of Optima Leisure which is based in Lagos. Quad biking, Jet skiing, wave boat, pontoon boat and seaside relaxation are some of the activities that can be enjoyed at Lekki Laisure Lake.  Tourists, fun seekers, children are welcome. The resort also takes safety very seriously.  Safety  The resort is very safe but visitors are advised to stay away from the lakeside without proper supervision.  Things to Do  Jet skiing and Quad riding is just one of the numerous things to do at Lekki Lake Resort  What to Bring  Visitors can go with a camera to take pictures and have fun memories of the day. Having enough money at hand is also very important.  Best Features  Its flurry of activities makes it a favourite destination for guests.  Best Time to Visit Lekki Leisure Lake  It is best to visit the lake during the weekends when there are a lot of guests and a lot of activities.  Most Common Visitors  The most common visitors of the resort are families coming to have fun.  Why You Should Visit  You should visit to take in the magnificent view of the resort and also to take part in the numerous activities available at the resort.&nbsp;",385,https://hotels.ng/places/beach/38-lekki-leisure-lake
Jos wildlife park,Plateau,Zoo,"About Jos wildlife park  Jos wildlife park was built to preserve wildlife. Jos wildlife park is one of the largest man-made zoological gardens in the country and is home to a variety of animals ranging from monkeys, elephants, lions. The variety of wildlife and closeness to nature is one of the many reasons why tourists come from far and wide to visit. Everybody is welcome!  Security/Safety of Jos wildlife park  This is a very safe location.   don't try to feed the animals  don't leave without your guide.   What To Bring  Before heading to Jos wildlife park, here are some helpful things to take along with you:   camera  water bottles   Things to do while at Jos wildlife park  Here are a few things you can do at Jos wildlife park:   take pictures of wildlife  reconnect with mother nature",2,https://hotels.ng/places/zoo/39-jos-wildlife-park
Rojenny Tourist Village,Anambra,Play ground,"History of Rojenny Tourist Village  Rojenny Tourist Village was built in 1983-1986 by Chief Rommy Amandi Ezeonwuka. It is notable for its close resemblance to Disney world and its welcoming ambience.  Ever wanted to go Disneyland? Well, Rojenny tourist village gives you a taste of what it would be like with its wide range of games, swimming pool, zoo, recreational center, restaurant, hotels. Our wide range of facilities makes us a dream tourist site. Come in today!  Security/Safety of Rojenny Tourist Village  This is a very safe location.   don't leave your bags unattended to   What To Bring  Before heading to Rojenny Tourist Village, here are some helpful things to take along with you:   camera  swimming gear   Things to do while at Rojenny Tourist Village  Before heading to Rojenny Tourist Village, here are some helpful things to take along with you:   visit the zoo  enjoy the wide range of facilities available",17,https://hotels.ng/places/play-ground/40-rojenny-tourist-village
Oguta lake holiday complex,Imo,Nature,"History of Oguta lake holiday complex  Oguta lake holiday complex was built in the early 1960s as an exclusive getaway for colonial masters. It was built by the British colonial government.  Oguta lake with its clear blue color and non-salty taste, is the perfect holiday destination for splashing around, boat cruising and many more. The second largest lake in Nigeria welcomes fun seekers, tourists and adventure lovers.  Security/Safety of Oguta lake holiday complex  This is a very safe location.  What To Bring  Before heading to Oguta lake holiday complex, here are some helpful things to take along with you:   swimming gear  camera   Things to do while at Oguta lake holiday complex  Here are a few things you can do at Oguta lake holiday complex:   swim in the lake  boat Cruise  visit the golf course",2,https://hotels.ng/places/nature/41-oguta-lake-holiday-complex
Enemabia warm spring,Benue,Waterfall,"About Enemabia warm spring  Enemabia warm spring with its lush scenery is an exotic location for people who enjoy swimming, nature and adventure. It is the only warm natural spring in Benue state, which contributes to the attraction it gets from tourists.&nbsp; &nbsp;  Security/Safety of Enemabia warm spring  This is a very safe location.  What To Bring  Before heading to Enemabia warm spring, here are some helpful things to take along with you:   swimming gear  camera   Things to do while at Enemabia warm spring  Here are some things you can do at Enemabia warm spring:   swim in the lake  take pictures of the surroundings",1,https://hotels.ng/places/waterfall/42-enemabia-warm-spring
Port Harcourt Tourist beach,Rivers,Beach,"About Port Harcourt Tourist beach  Port Harcourt Tourist beach was built in 1988. It is a white sand beach and leisure hub in PortHacourt, Rivers state.  Serenaded by the beauty of Port Harcourt and in need of where to hang? The Port Harcourt Tourist Beach is the perfect destination for tourists and fun seekers with its white sands and cool ocean breeze. There is an historical center you can visit as a tourist when you are at this urban beach.  Security/Safety of Port Harcourt Tourist beach  This is a very safe location.  What To Bring  Before heading to Port Harcourt Tourist beach, here are some helpful things to take along with you:   water bottles  shorts  sandals",574,https://hotels.ng/places/beach/43-port-harcourt-tourist-beach
Benin city national museum,Edo,Museum,"History of Benin city national museum  Benin city national museum was built on August 10, 1973, by the National Commission for museums and monuments. It is located in the city centre on King's Square.  Benin national museum is home to priceless Benin art, history, antiques and other artefacts from around the country. Everyone is invited to come to learn and experience Benin culture.  Security/Safety of Benin city national museum  This is a very safe location.  Things to do while at Benin city national museum  You can do these at the Benin city national museum:   visit the terracotta sculptures  educate yourself about the Benin kingdom",16,https://hotels.ng/places/museum/44-benin-city-national-museum
Abraka Turf and Country Club,Delta,Club,"History of Abraka Turf and Country Club  Abraka Turf and Country Club.  Villas, chalets, golf courses, racing, kayaking are all indices of the club's willingness to provide leisure and exquisite services to either the vacation camper, fun lover or tourists.  Security/Safety of Abraka Turf and Country Club  This is a very safe location.   don't leave your guide.   What To Bring  Before heading to Abraka Turf and Country Club, here is something helpful to take along with you:   camping gear   Things to do while at Abraka Turf and Country Club  You can do these at Abraka Turf and Country Club:   visit the golf course  go fishing  participate in the polo tournament",1,https://hotels.ng/places/club/45-abraka-turf-and-country-club
Jhalobia Recreation Parks and Garden,Lagos,Resort,"History of Jhalobia Recreation Parks and Garden  Jhalobia Recreation Parks and Garden was built in 1998 to ensure that people could have an outdoor experience while connecting to nature. It is notable as an event center for picnics, weddings etc. It was built by Mrs. Veronica Adepoju in.  When man meets nature, the result is a beautiful garden and event center that caters to your needs whether you are a nature enthusiast, or you need a place for your wedding or other social events.  Security/Safety of Jhalobia Recreation Parks and Garden  This is a very safe location.  Things to do while at Jhalobia Recreation Parks and Garden  Here are things you can do while at Jhalobia Recreation Parks and Garden:   take pictures of the surroundings.  reconnect with nature  horse riding",373,https://hotels.ng/places/resort/46-jhalobia-recreation-parks-and-garden
"National War Museum, Umuahia",Abia,Museum,"History of National War Museum, Umuahia  National War Museum, Umuahia was established in 1985 with the aim of putting the ugly episode of the war behind and speeding up the process of national reconciliation and healing. It is notable as a sanctuary of the relics from the Biafran-Nigerian civil war that took place between 1967 and 1970.  Ever heard of Ogbunigwe? Want to know more about the Nigerian civil war? The National war museum is a sanctuary of both traditional and modern warfare and opens its doors far and wide to people seeking to know more about this portion of Nigerian history. The museum has three galleries that cover traditional warfare, the armed forces and the Nigerian Civil War weapon galleries.  Definitely worth your visit.  Security/Safety of National War Museum, Umuahia  This is a very safe location.  What To Bring  Before heading to National War Museum, Umuahia, here are some helpful things to take along with you:   camera- there is a lot of history waiting to be captured   Things to do while at National War Museum, Umuahia  These are things you can do at the National War Museum:   see the Biafran flag also known as 'half of a yellow sun'  visit the defunct radio Biafra",30,https://hotels.ng/places/museum/47-national-war-museum-umuahia
International Institute of Tropical Agriculture,Oyo,College,"About International Institute of Tropical Agriculture  International Institute of Tropical Agriculture.  Interested in Agricultural research? Or fun-seeking? The international institute of Tropical Agriculture provides an avenue for those seeking to have fun or for those interested in Agricultural research to explore their reasons. The International Institute of Tropical Agriculture (IITA), as a non-profit institution, works to create agricultural innovations that can provide solutions to Africa&rsquo;s most pressing challenges of hunger, malnutrition, poverty, and natural resource degradation.  The main focus of IITA is to ensure that there is food security for now and the future in many countries in Africa of which Nigeria is one. Agriculturists would fall in love with this place upon visiting.  Security/Safety of International Institute of Tropical Agriculture  This is a very safe location.  What To Bring  Before heading to the International Institute of Tropical Agriculture, here are some helpful things to take along with you:   camera  swimming gear  Relaxation gears   Things to do while at the International Institute of Tropical Agriculture  Here are things you can do at IITA:   bird watching  walking with the wild.",0,https://hotels.ng/places/college/48-international-institute-of-tropical-agriculture
"Millennium Park, Abuja",Abuja,Park,"History of Millennium Park, Abuja  Millennium Park, Abuja was established in 2003. It is notable as the place that has hosted the most amount of foreign personalities in the country. Built by Queen Elizabeth II in 2003, it has since remained one of the largest public parks in Abuja. Millennium park covers a land of about 32 hectares.  With its serene environment, Millennium Park is the perfect choice when looking for a place for a picnic, dog walking or bird watching.  Security/Safety of Millennium Park, Abuja  This is a very safe location.  What To Bring  Before heading to Millennium Park, Abuja, here are some helpful things to take along with you:   camera   Things to do while at Millennium Park, Abuja  Here are things you can do at Millennium Park:   connect with nature  bird watching  picnic",221,https://hotels.ng/places/park/49-millennium-park-abuja
Wonderland Amusement Park and Resort,Abuja,Park,"History of Wonderland Amusement Park and Resort  Wonderland Amusement Park and Resort was built in 2007 to mark the celebration of March 1st. It is notable as the biggest and most equipped amusement park in Nigeria.  Built by Chief Olusegun Obasanjo in 2007.  &nbsp;  Security/Safety of Wonderland Amusement Park and Resort  This is a very safe location.  What To Bring  Before heading to Wonderland Amusement Park and Resort, here are some helpful things to take along with you:   Camera- you don't want to miss a moment.   Things to do while at Wonderland Amusement Park and Resort  Before heading to Wonderland Amusement Park and Resort, here are some helpful things to take along with you:   roller coaster ride  play arcade games   Best Features  Wonderland Amusement Park is an ultramodern facility that offers premium leisure services to fun-seekers. With its wide range of activities offered, everybody is guaranteed a fun time!",253,https://hotels.ng/places/park/50-wonderland-amusement-park-and-resort
Funtopia water park,Lagos,Park,"About Funtopia water park  Funtopia water park is an entertainment park for everyone located in Lagos. It is notable as the first facility of its type.  Funtopia Park, with its modern indoor and outdoor facilities, offers fun-filled activities to both old and young. The doors of Funtopia are open to those looking to relax from the stress of Lagos.  Security/Safety of Funtopia water park  This is a very safe location.  What To Bring  Before heading to Funtopia water park, here are some helpful things to take along with you:   swimming gear  camera- to capture the memories   Things to do while at Funtopia water park  Here are things you can do at Funtopia water park:   go swimming  water sliding  Enjoy the scenery  Take relaxation spots","1,050",https://hotels.ng/places/park/51-funtopia-water-park
